name,description,passed,score,duration_seconds,n_trials,details
rule_shift_adaptation,Belief revision under accumulating low-surprise evidence,True,1,0.088599,30,"{""repeat_trials"": 30, ""base_seed"": 0, ""trial_seed_strategy"": ""trial_seed = base_seed + trial_index * 1000003"", ""mean_score"": 1.0, ""score_variance"": 0.0, ""confidence_interval_95"": [1.0, 1.0], ""trial_scores"": [1.0, 1.0, 1.0, 1.0, 1.0, 1.0, 1.0, 1.0, 1.0, 1.0, 1.0, 1.0, 1.0, 1.0, 1.0, 1.0, 1.0, 1.0, 1.0, 1.0, 1.0, 1.0, 1.0, 1.0, 1.0, 1.0, 1.0, 1.0, 1.0, 1.0], ""trial_revised_flags"": [true, true, true, true, true, true, true, true, true, true, true, true, true, true, true, true, true, true, true, true, true, true, true, true, true, true, true, true, true, true], ""representative_last_trial_details"": {""trial_index"": 29, ""trial_seed"": 29000087, ""initial_value"": ""rome"", ""challenger_value"": ""paris"", ""final_value"": ""paris"", ""n_initial_claims"": 5, ""n_challenger_claims"": 8, ""n_reflections"": 1, ""reflection_kinds"": [""belief_revision""], ""revised"": true, ""final_log_odds"": 1.001239, ""updates_to_converge"": 1, ""completeness_score"": 1.0, ""log_odds_threshold"": 0.3}}"
adversarial_prompt_resistance,Hypothesis masking convergence on valid tokens under adversarial rejection,True,1,0.000246048,50,"{""successes"": 50, ""vocab_size"": 100, ""n_bad_tokens"": 15, ""max_iterations"": 10, ""avg_convergence_steps"": 1.12, ""convergence_steps_histogram"": {""1"": 45, ""2"": 4, ""3"": 1}}"
causal_reasoning_simpson,Simpson's paradox: do-calculus recovers correct ATE despite confounding,True,1,0.210666,1,"{""p_y_given_t1"": 0.35, ""p_y_given_t0"": 0.65, ""naive_suggests_helps"": false, ""p_y_do_t1"": 0.55, ""p_y_do_t0"": 0.45, ""ate"": 0.1, ""do_says_helps"": true, ""counterfactual_p_y0_given_t1y1_do_t0"": 0.2857, ""backdoor_sets"": [[""S""]], ""backdoor_adjusted_p"": 0.55}"
semantic_memory_fidelity,Write/recall fidelity over N random triples,True,1,0.011307,100,"{""n_triples"": 100, ""correct_recalls"": 100, ""recall_rate"": 1.0, ""avg_confidence_error"": 0.0}"
conformal_coverage_guarantee,Split-conformal coverage >= 0.90 (alpha=0.1),True,0.944,0.0133092,500,"{""score_methodology"": ""score = round((lac_coverage + aps_coverage) / 2, 4); lac_coverage and aps_coverage are empirical frequencies from empirical_coverage(predictor, test_data) over n_test held-out (distribution, label) pairs after split calibration on n_calibration draws each (LAC from label probs; APS from full softmax vectors). Equal weights; rounding applied only when storing score."", ""alpha"": 0.1, ""target_coverage"": 0.9, ""lac_coverage"": 0.904, ""aps_coverage"": 0.984, ""lac_meets_target"": true, ""aps_meets_target"": true, ""avg_lac_set_size"": 2.6, ""avg_aps_set_size"": 3.52, ""n_calibration"": 200, ""n_test"": 500}"
vsa_algebraic_fidelity,VSA bind/unbind round-trip accuracy across dimensionalities,True,1,0.0733981,150,"{""per_dimensionality"": {""1000"": {""accuracy"": 1.0, ""avg_cosine"": 0.5095, ""n_triples"": 50, ""correct"": 50}, ""5000"": {""accuracy"": 1.0, ""avg_cosine"": 0.5003, ""n_triples"": 50, ""correct"": 50}, ""10000"": {""accuracy"": 1.0, ""avg_cosine"": 0.5012, ""n_triples"": 50, ""correct"": 50}}, ""dims_tested"": [1000, 5000, 10000]}"
hopfield_retrieval_accuracy,Modern Continuous Hopfield one-step retrieval at varying store sizes,True,0.7125,0.0317388,160,"{""d_model"": 256, ""per_store_size"": {""10"": {""accuracy"": 1.0, ""avg_cosine"": 1.0, ""n_queries"": 10, ""correct"": 10}, ""50"": {""accuracy"": 0.72, ""avg_cosine"": 0.7402, ""n_queries"": 50, ""correct"": 36}, ""100"": {""accuracy"": 0.84, ""avg_cosine"": 0.8485, ""n_queries"": 50, ""correct"": 42}, ""500"": {""accuracy"": 0.52, ""avg_cosine"": 0.5783, ""n_queries"": 50, ""correct"": 26}}, ""store_sizes_tested"": [10, 50, 100, 500]}"
active_inference_decision_quality,EFE-driven Tiger POMDP agent vs random baseline,True,0.87,0.016916,200,"{""agent_success_rate"": 0.87, ""random_success_rate"": 0.425, ""advantage_over_random"": 0.445, ""agent_mean_return"": 0.6, ""random_mean_return"": -0.6508, ""n_episodes"": 200, ""max_steps"": 3}"
